{
  "schema_version": 1,
  "task_id": "orchestration-upgrade",
  "goal": "Shared workflows and behavior-preserving application refactoring",
  "constraints": [
    "No commits or live operations",
    "Preserve API behavior and JEV-only policy",
    "User blueprint remains unchanged"
  ],
  "evidence": [
    "docs/architecture.md",
    ".agent/index/repo-map.json",
    ".agent/tasks/orchestration-upgrade/verification.md",
    "artifacts/agent/application-verification.json (local ignored evidence)"
  ],
  "changed_files": [
    "AGENTS.md",
    "docs/architecture.md",
    "docs/operations.md",
    "eslint.config.mjs",
    "package.json",
    "scripts/rematch-deterministic.ts",
    "src/app/api/actions/route.ts",
    "src/app/api/intelligence/route.ts",
    "src/app/api/onboarding/route.ts",
    "src/components/dashboard.tsx",
    "src/components/workspace-page.tsx",
    "src/lib/intelligence/worker.ts",
    "src/lib/sync.ts",
    "tests/database.test.ts",
    "tsconfig.json",
    ".agent/context/navigation.md",
    ".agent/context/project.md",
    ".agent/index/repo-map.json",
    ".agent/schemas/handoff.schema.json",
    ".agent/schemas/task-state.schema.json",
    ".agent/scripts/context-check.mjs",
    ".agent/scripts/contracts.mjs",
    ".agent/scripts/verify.mjs",
    ".agent/tasks/orchestration-upgrade/brief.md",
    ".agent/tasks/orchestration-upgrade/plan.md",
    ".agent/tasks/orchestration-upgrade/state.json",
    ".agent/tasks/orchestration-upgrade/verification.md",
    "src/components/dashboard/activity-view.tsx",
    "src/components/dashboard/empty.tsx",
    "src/components/dashboard/job-detail.tsx",
    "src/components/dashboard/jobs-view.tsx",
    "src/components/dashboard/modal-dialog.tsx",
    "src/components/dashboard/monitor-form.tsx",
    "src/components/dashboard/monitors-view.tsx",
    "src/components/dashboard/overview-view.tsx",
    "src/components/dashboard/settings-view.tsx",
    "src/components/dashboard/shared.tsx",
    "src/components/dashboard/source-form.tsx",
    "src/components/dashboard/sources-view.tsx",
    "src/components/dashboard/stat.tsx",
    "src/lib/actions/job-state.ts",
    "src/lib/actions/monitors.ts",
    "src/lib/actions/profile.ts",
    "src/lib/actions/sources.ts",
    "src/lib/matching-repository.ts",
    "tests/actions.test.ts",
    "tests/agent-workflow.test.ts",
    "tests/architecture.test.ts",
    "tests/dashboard-views.test.ts",
    "tests/matching-repository.test.ts"
  ],
  "verification": [
    "Baseline: lint, typecheck, 100 tests, and production build PASS",
    "Final npm run agent:verify -- --application: PASS",
    "Final Vitest: 20 files, 132 tests PASS",
    "Desktop and 390px mobile local demo smoke checks performed",
    "Blueprint SHA256 unchanged: 3a613d40928fc884bbc4ae85b37a89dce6b2f2042a0a60b3d92be940caa891ca"
  ],
  "remaining": []
}
